Name,Type,Prescription Required,Description
Paracetamol,Acute,No,A common pain reliever and fever reducer
Ibuprofen,Acute,No,Nonsteroidal anti-inflammatory drug (NSAID) used to reduce pain
Aspirin,Acute/Periodic,No,NSAID used to treat pain fever and inflammation. It is also used to prevent blood clots and reduce the risk of heart attack and stroke
Loratadine,Periodic,No,Antihistamine used to treat symptoms of allergies such as sneezing
Cetirizine,Periodic,No,Antihistamine used to treat symptoms of seasonal allergies such as sneezing
